{
  "$schema": "https://json-schema.org/draft/2020-12/schema",
  "$id": "https://github.com/abusetelegram/xixi-haha/blob/data/schema.json",
  "title": "xixi-haha canonical article",
  "type": "object",
  "additionalProperties": false,
  "required": [
    "id",
    "title",
    "date",
    "author",
    "editor",
    "article",
    "text"
  ],
  "properties": {
    "id": {
      "type": "string",
      "pattern": "^[1-9][0-9]*$"
    },
    "title": {
      "type": "string"
    },
    "date": {
      "type": "string"
    },
    "author": {
      "type": "string"
    },
    "editor": {
      "type": "string"
    },
    "article": {
      "type": "string"
    },
    "text": {
      "type": "array",
      "items": {
        "type": "string"
      }
    },
    "content_type": {
      "const": "image"
    },
    "media": {
      "type": "array",
      "minItems": 1,
      "items": {
        "type": "object",
        "additionalProperties": false,
        "required": [
          "type",
          "url",
          "alt"
        ],
        "properties": {
          "type": {
            "const": "image"
          },
          "url": {
            "type": "string",
            "pattern": "^https?://(?![^/\\s]*@)[^\\s?#]+\\.(?:[jJ][pP][eE]?[gG]|[pP][nN][gG]|[gG][iI][fF]|[wW][eE][bB][pP]|[bB][mM][pP])(?:[?#][^\\s]*)?$"
          },
          "alt": {
            "type": "string"
          }
        }
      }
    }
  },
  "oneOf": [
    {
      "not": {
        "anyOf": [
          {
            "required": [
              "content_type"
            ]
          },
          {
            "required": [
              "media"
            ]
          }
        ]
      }
    },
    {
      "required": [
        "content_type",
        "media"
      ],
      "properties": {
        "text": {
          "maxItems": 0
        }
      }
    }
  ]
}
