{
  "id": "32584628",
  "title": "习近平会见阿曼内阁副首相法赫德亲王",
  "date": "2022-12-10 11:37:38",
  "author": "人民网－人民日报",
  "editor": "(责编：王潇潇                     )",
  "article": "<div class=\"d2txt_con clearfix\">\n<p><table class=\"pci_c\" width=\"100%\">\n<tbody>\n<tr>\n<td align=\"center\">\n<img src=\"https://paper.people.com.cn/rmrb/images/1/20221210/1670636357703_1.jpg\"/></td>\n</tr>\n<tr>\n<td>\n<p>\n\t\t\t\t\t　　当地时间12月9日下午，国家主席习近平在利雅得会见阿曼内阁副首相法赫德亲王。<br/>\n\t\t\t\t\t　　新华社记者 黄敬文摄</p>\n</td>\n</tr>\n</tbody>\n</table>\n<p>\n\t　　本报利雅得12月9日电  （记者黄培昭、颜欢）当地时间12月9日下午，国家主席习近平在利雅得会见阿曼内阁副首相法赫德亲王。</p>\n<p>\n\t　　习近平指出，中阿友谊历史悠久，当年的海上丝绸之路把两国联系在一起。新形势下，中方愿同阿方巩固互信，深化友好合作，推动中阿战略伙伴关系取得新进展。希望阿曼继续积极参与中阿集体合作。祝贺阿曼即将担任下届海合会轮值主席国，愿同阿曼一道，推动中阿和中海关系取得新进展。</p>\n<p>\n\t　　法赫德表示，阿曼同中国的友谊源远流长。中国人民是友爱、善良的人民，中国是热爱和平、维护和平的国家。阿方期待进一步加强阿中关系。今天召开的首届海中、阿中峰会具有重要历史意义，阿方愿同中方一道，促进海中、阿中关系得到更大发展。</p>\n<p>\n\t　　丁薛祥、王毅、何立峰等参加会见。</p>\n<br/>\n<p>\n<span id=\"paper_num\">　　《 人民日报 》（ 2022年12月10日 03 版）</span></p>\n</p>\n</div>",
  "text": [
    "当地时间12月9日下午，国家主席习近平在利雅得会见阿曼内阁副首相法赫德亲王。",
    "新华社记者 黄敬文摄",
    "本报利雅得12月9日电  （记者黄培昭、颜欢）当地时间12月9日下午，国家主席习近平在利雅得会见阿曼内阁副首相法赫德亲王。",
    "习近平指出，中阿友谊历史悠久，当年的海上丝绸之路把两国联系在一起。新形势下，中方愿同阿方巩固互信，深化友好合作，推动中阿战略伙伴关系取得新进展。希望阿曼继续积极参与中阿集体合作。祝贺阿曼即将担任下届海合会轮值主席国，愿同阿曼一道，推动中阿和中海关系取得新进展。",
    "法赫德表示，阿曼同中国的友谊源远流长。中国人民是友爱、善良的人民，中国是热爱和平、维护和平的国家。阿方期待进一步加强阿中关系。今天召开的首届海中、阿中峰会具有重要历史意义，阿方愿同中方一道，促进海中、阿中关系得到更大发展。",
    "丁薛祥、王毅、何立峰等参加会见。",
    "《 人民日报 》（ 2022年12月10日 03 版）"
  ]
}
