{
  "id": "23446932",
  "title": "组图：总书记来到湖南",
  "date": "2013-11-06 08:35:08",
  "author": "湖南日报",
  "editor": "杨丽娜",
  "article": "<div class=\"d2txt_con clearfix\">\n<p></p><p align=\"center\" style=\"text-align:center\">\n<img alt=\"\" src=\"http://www.people.com.cn/mediafile/pic/20131106/89/5315053693284331901.jpg\"/></p>\n<p>\n　　11月3日，习近平同志在湘西土家族苗族自治州花垣县排碧乡调研，与村民边走边谈。</p>\n<div style=\"page-break-after: always;\">\n<span style=\"display: none;\"> </span></div>\n<p align=\"center\" style=\"text-align:center\">\n<img alt=\"\" src=\"http://www.people.com.cn/mediafile/pic/20131106/83/4674271974740977275.jpg\"/></p>\n<p align=\"center\" class=\"pictext\" style=\"text-align:center\">\n　　11月3日，习近平同志来到位于吉首市的矮寨特大悬索桥视察。</p>\n<div style=\"page-break-after: always;\">\n<span style=\"display: none;\"> </span></div>\n<p align=\"center\" style=\"text-align:center\">\n<img alt=\"\" src=\"http://www.people.com.cn/mediafile/pic/20131106/90/18031603090370714278.jpg\"/></p>\n<p align=\"center\" class=\"pictext\" style=\"text-align:center\">\n　　11月3日，习近平同志在湘西土家族苗族自治州花垣县排碧乡同村民座谈。</p>\n<div style=\"page-break-after: always;\">\n<span style=\"display: none;\"> </span></div>\n<p align=\"center\" style=\"text-align:center\">\n<img alt=\"\" src=\"http://www.people.com.cn/mediafile/pic/20131106/24/17519455333167730080.jpg\"/></p>\n<p>\n　　11月3日下午，习近平同志在湘西土家族苗族自治州花垣县排碧乡十八洞村看望乡亲，调研扶贫开发工作。新华社记者 王晔 摄</p>\n<div style=\"page-break-after: always;\">\n<span style=\"display: none;\"> </span></div>\n<p align=\"center\" style=\"text-align:center\">\n<img alt=\"\" src=\"http://www.people.com.cn/mediafile/pic/20131106/58/1292198689907963050.jpg\"/></p>\n<p>\n　　11月3日，习近平同志在湘西土家族苗族自治州凤凰县廖家桥镇菖蒲塘村水果基地考察，与村民亲切交谈。</p>\n<div style=\"page-break-after: always;\">\n<span style=\"display: none;\"> </span></div>\n<p align=\"center\" style=\"text-align:center\">\n<img alt=\"\" src=\"http://www.people.com.cn/mediafile/pic/20131106/24/2676400199011874700.jpg\"/></p>\n<p>\n　　11月4日， 习近平同志来到中南大学，考察粉末冶金国家重点实验室，了解高校进行科技创新、服务国家重大战略项目情况。</p>\n<div style=\"page-break-after: always;\">\n<span style=\"display: none;\"> </span></div>\n<p align=\"center\" style=\"text-align:center\">\n<img alt=\"\" src=\"http://www.people.com.cn/mediafile/pic/20131106/26/3186577631676719242.jpg\"/></p>\n<p align=\"center\" class=\"pictext\" style=\"text-align:center\">\n　　11月4日，习近平同志在长沙考察威胜集团有限公司。（除署名外照片均由记者张目摄）</p>\n</div>",
  "text": [
    "11月3日，习近平同志在湘西土家族苗族自治州花垣县排碧乡调研，与村民边走边谈。",
    "11月3日，习近平同志来到位于吉首市的矮寨特大悬索桥视察。",
    "11月3日，习近平同志在湘西土家族苗族自治州花垣县排碧乡同村民座谈。",
    "11月3日下午，习近平同志在湘西土家族苗族自治州花垣县排碧乡十八洞村看望乡亲，调研扶贫开发工作。新华社记者 王晔 摄",
    "11月3日，习近平同志在湘西土家族苗族自治州凤凰县廖家桥镇菖蒲塘村水果基地考察，与村民亲切交谈。",
    "11月4日， 习近平同志来到中南大学，考察粉末冶金国家重点实验室，了解高校进行科技创新、服务国家重大战略项目情况。",
    "11月4日，习近平同志在长沙考察威胜集团有限公司。（除署名外照片均由记者张目摄）"
  ]
}
