{
  "id": "31763222",
  "title": "图解：建党99周年 跟着总书记学党章",
  "date": "2020-06-29 11:16:05",
  "author": "人民网-中国共产党新闻网",
  "editor": "吕腾龙",
  "article": "<div class=\"d2txt_con clearfix\">\n<p></p><p style=\"text-align: center\">\n<img alt=\"\" src=\"http://cpc.people.com.cn/NMediaFile/2020/0629/MAIN202006291115228698195538661.jpg\"/></p>\n</div>",
  "text": []
}
