{
  "id": "31153742",
  "title": "习近平向“2019·中国西藏发展论坛”致贺信",
  "date": "2019-06-15 08:29:23",
  "author": "人民网－人民日报",
  "editor": "任佳晖",
  "article": "<div class=\"d2txt_con clearfix\">\n<p></p><p style=\"text-indent: 2em;\">\n新华社北京6月14日电  6月14日，“2019·中国西藏发展论坛”在西藏拉萨举行。国家主席习近平发来贺信，向论坛开幕表示祝贺。</p>\n<p style=\"text-indent: 2em;\">\n习近平指出，西藏地处青藏高原腹地，是中国的一个重要边疆民族地区，是重要的生态安全屏障、重要的中华民族特色文化保护地、重要的世界旅游目的地。</p>\n<p style=\"text-indent: 2em;\">\n习近平强调，2019年是新中国成立70周年，也是西藏民主改革60周年。在中国共产党领导下，短短几十年，西藏实现了历史上最广泛最深刻的社会变革，百万农奴翻身解放，成为国家和社会的主人。在中央政府和全国人民大力支持下，西藏人民团结奋斗，把贫穷落后的旧西藏建设成了经济文化繁荣、社会全面进步、生态环境良好、人民生活幸福的新西藏。希望西藏抓住发展机遇，建设美丽幸福西藏，繁荣优秀传统文化，保护高原生态环境，实施更加积极的开放政策，广泛开展对外交流合作，描绘新时代西藏发展新画卷。</p>\n<p style=\"text-indent: 2em;\">\n<span id=\"paper_num\" style=\"text-indent: 2em; display: block;\">《 人民日报 》（ 2019年06月15日 03 版）</span></p>\n</div>",
  "text": [
    "新华社北京6月14日电  6月14日，“2019·中国西藏发展论坛”在西藏拉萨举行。国家主席习近平发来贺信，向论坛开幕表示祝贺。",
    "习近平指出，西藏地处青藏高原腹地，是中国的一个重要边疆民族地区，是重要的生态安全屏障、重要的中华民族特色文化保护地、重要的世界旅游目的地。",
    "习近平强调，2019年是新中国成立70周年，也是西藏民主改革60周年。在中国共产党领导下，短短几十年，西藏实现了历史上最广泛最深刻的社会变革，百万农奴翻身解放，成为国家和社会的主人。在中央政府和全国人民大力支持下，西藏人民团结奋斗，把贫穷落后的旧西藏建设成了经济文化繁荣、社会全面进步、生态环境良好、人民生活幸福的新西藏。希望西藏抓住发展机遇，建设美丽幸福西藏，繁荣优秀传统文化，保护高原生态环境，实施更加积极的开放政策，广泛开展对外交流合作，描绘新时代西藏发展新画卷。",
    "《 人民日报 》（ 2019年06月15日 03 版）"
  ]
}
