{
  "id": "40690634",
  "title": "中共中央政治局召开会议 审议《中国共产党地方委员会工作条例》中共中央总书记习近平主持会议",
  "date": "2026-03-28 08:23:44",
  "author": "人民网－人民日报",
  "editor": "(责编：刘圆圆)",
  "article": "<div class=\"d2txt_con clearfix\">\n<p><p>　<strong>　■ 地方党委要坚决维护以习近平同志为核心的党中央权威和集中统一领导，把贯彻落实党中央决策部署作为重中之重，对党中央定下来的事扭住不放、狠抓落实，同时紧密结合本地区实际，增强工作主动性、创造性</strong></p>\n<p><strong>　　■ 地方党委在谋发展保安全上责无旁贷，要脚踏实地、真抓实干。要完整准确全面贯彻新发展理念，扎扎实实推动高质量发展，着力保障和改善民生，全力维护国家安全和社会大局稳定。要树立和践行正确政绩观，坚持为人民出政绩、以实干出政绩，努力创造经得起实践、人民、历史检验的实绩。要在地方党委领导班子中强化民主集中制教育，完善议事决策规则，细化负面清单，健全监督机制，明确监督重点事项、具体措施、责任追究等内容，确保民主集中制严格贯彻执行。地方党委领导班子成员要加强理论学习，提高专业素质，着力提高领导能力。要扛起管党治党政治责任，坚定不移推进全面从严治党，锲而不舍严格贯彻中央八项规定及其实施细则精神，深入整治形式主义为基层减负，依法依规用权，守好廉洁底线，推动形成风清气正的政治生态</strong></p>\n<p>　　</p>\n<p>　　新华社北京3月27日电  中共中央政治局3月27日召开会议，审议《中国共产党地方委员会工作条例》。中共中央总书记习近平主持会议。</p>\n<p>　　会议指出，地方党委要坚决维护以习近平同志为核心的党中央权威和集中统一领导，把贯彻落实党中央决策部署作为重中之重，对党中央定下来的事扭住不放、狠抓落实，同时紧密结合本地区实际，增强工作主动性、创造性。</p>\n<p>　　会议强调，地方党委在谋发展保安全上责无旁贷，要脚踏实地、真抓实干。要完整准确全面贯彻新发展理念，扎扎实实推动高质量发展，着力保障和改善民生，全力维护国家安全和社会大局稳定。要树立和践行正确政绩观，坚持为人民出政绩、以实干出政绩，努力创造经得起实践、人民、历史检验的实绩。要在地方党委领导班子中强化民主集中制教育，完善议事决策规则，细化负面清单，健全监督机制，明确监督重点事项、具体措施、责任追究等内容，确保民主集中制严格贯彻执行。地方党委领导班子成员要加强理论学习，提高专业素质，着力提高领导能力。要扛起管党治党政治责任，坚定不移推进全面从严治党，锲而不舍严格贯彻中央八项规定及其实施细则精神，深入整治形式主义为基层减负，依法依规用权，守好廉洁底线，推动形成风清气正的政治生态。</p>\n<p>　　会议还研究了其他事项。</p>\n<p></p>\n<p><span id=\"paper_num\">　　《 人民日报 》（ 2026年03月28日 01 版）</span></p> </p>\n</div>",
  "text": [
    "■ 地方党委要坚决维护以习近平同志为核心的党中央权威和集中统一领导，把贯彻落实党中央决策部署作为重中之重，对党中央定下来的事扭住不放、狠抓落实，同时紧密结合本地区实际，增强工作主动性、创造性",
    "■ 地方党委在谋发展保安全上责无旁贷，要脚踏实地、真抓实干。要完整准确全面贯彻新发展理念，扎扎实实推动高质量发展，着力保障和改善民生，全力维护国家安全和社会大局稳定。要树立和践行正确政绩观，坚持为人民出政绩、以实干出政绩，努力创造经得起实践、人民、历史检验的实绩。要在地方党委领导班子中强化民主集中制教育，完善议事决策规则，细化负面清单，健全监督机制，明确监督重点事项、具体措施、责任追究等内容，确保民主集中制严格贯彻执行。地方党委领导班子成员要加强理论学习，提高专业素质，着力提高领导能力。要扛起管党治党政治责任，坚定不移推进全面从严治党，锲而不舍严格贯彻中央八项规定及其实施细则精神，深入整治形式主义为基层减负，依法依规用权，守好廉洁底线，推动形成风清气正的政治生态",
    "新华社北京3月27日电  中共中央政治局3月27日召开会议，审议《中国共产党地方委员会工作条例》。中共中央总书记习近平主持会议。",
    "会议指出，地方党委要坚决维护以习近平同志为核心的党中央权威和集中统一领导，把贯彻落实党中央决策部署作为重中之重，对党中央定下来的事扭住不放、狠抓落实，同时紧密结合本地区实际，增强工作主动性、创造性。",
    "会议强调，地方党委在谋发展保安全上责无旁贷，要脚踏实地、真抓实干。要完整准确全面贯彻新发展理念，扎扎实实推动高质量发展，着力保障和改善民生，全力维护国家安全和社会大局稳定。要树立和践行正确政绩观，坚持为人民出政绩、以实干出政绩，努力创造经得起实践、人民、历史检验的实绩。要在地方党委领导班子中强化民主集中制教育，完善议事决策规则，细化负面清单，健全监督机制，明确监督重点事项、具体措施、责任追究等内容，确保民主集中制严格贯彻执行。地方党委领导班子成员要加强理论学习，提高专业素质，着力提高领导能力。要扛起管党治党政治责任，坚定不移推进全面从严治党，锲而不舍严格贯彻中央八项规定及其实施细则精神，深入整治形式主义为基层减负，依法依规用权，守好廉洁底线，推动形成风清气正的政治生态。",
    "会议还研究了其他事项。",
    "《 人民日报 》（ 2026年03月28日 01 版）"
  ]
}
