{
  "id": "31971870",
  "title": "中央军委举行晋升上将军衔警衔仪式 习近平颁发命令状并向晋衔的军官警官表示祝贺",
  "date": "2020-12-18 18:51:05",
  "author": "新华社“新华视点”微博",
  "editor": "任一林",
  "article": "<div class=\"d2txt_con clearfix\">\n<p></p><p align=\"center\" style=\"text-align:center\">\n<img alt=\"\" src=\"http://cpc.people.com.cn/mediafile/pic/20201218/5/8240117907340109381.jpg\"/></p>\n<p>\n　　中央军委晋升上将军衔警衔仪式18日在北京八一大楼隆重举行。中央军委主席习近平向晋升上将军衔警衔的军官警官颁发命令状。</p>\n<p>\n　　下午5时15分许，晋衔仪式在庄严的国歌声中开始。中央军委副主席许其亮宣读了中央军委主席习近平签署的晋升上将军衔警衔命令。中央军委副主席张又侠主持晋衔仪式。</p>\n<p>\n　　这次晋升上将军衔警衔的军官警官是：军委后勤保障部政治委员郭普校、西部战区司令员张旭东、战略支援部队政治委员李伟、武警部队司令员王春宁。</p>\n<p>\n　　晋升上将军衔警衔的4位军官警官军容严整、精神抖擞来到主席台前。习近平向他们颁发命令状，表示祝贺。佩戴了上将军衔警衔肩章的4位军官警官向习近平敬礼，向参加仪式的全体同志敬礼，全场响起热烈的掌声。</p>\n<p>\n　　晋衔仪式在嘹亮的军歌声中结束。随后，习近平等领导同志同晋升上将军衔警衔的军官警官合影。</p>\n<p>\n　　中央军委委员魏凤和、李作成、苗华、张升民，以及军委机关各部门、驻京大单位主要领导等参加晋衔仪式。（记者：李宣良 摄影：李刚）</p>\n</div>",
  "text": [
    "中央军委晋升上将军衔警衔仪式18日在北京八一大楼隆重举行。中央军委主席习近平向晋升上将军衔警衔的军官警官颁发命令状。",
    "下午5时15分许，晋衔仪式在庄严的国歌声中开始。中央军委副主席许其亮宣读了中央军委主席习近平签署的晋升上将军衔警衔命令。中央军委副主席张又侠主持晋衔仪式。",
    "这次晋升上将军衔警衔的军官警官是：军委后勤保障部政治委员郭普校、西部战区司令员张旭东、战略支援部队政治委员李伟、武警部队司令员王春宁。",
    "晋升上将军衔警衔的4位军官警官军容严整、精神抖擞来到主席台前。习近平向他们颁发命令状，表示祝贺。佩戴了上将军衔警衔肩章的4位军官警官向习近平敬礼，向参加仪式的全体同志敬礼，全场响起热烈的掌声。",
    "晋衔仪式在嘹亮的军歌声中结束。随后，习近平等领导同志同晋升上将军衔警衔的军官警官合影。",
    "中央军委委员魏凤和、李作成、苗华、张升民，以及军委机关各部门、驻京大单位主要领导等参加晋衔仪式。（记者：李宣良 摄影：李刚）"
  ]
}
