{
  "id": "29533058",
  "title": "习近平向联合国世界旅游组织第22届全体大会致贺词",
  "date": "2017-09-13 10:44:40",
  "author": "新华社",
  "editor": "姜萍萍",
  "article": "<div class=\"d2txt_con clearfix\">\n<p></p><p style=\"text-indent: 2em\">\n联合国世界旅游组织第22届全体大会13日在四川成都开幕。国家主席习近平向大会致贺词。</p>\n<p style=\"text-indent: 2em\">\n习近平指出，旅游是不同国家、不同文化交流互鉴的重要渠道，是发展经济、增加就业的有效手段，也是提高人民生活水平的重要产业。</p>\n<p style=\"text-indent: 2em\">\n习近平强调，中国高度重视发展旅游业，旅游业对中国经济和就业的综合贡献率已超过10%。未来5年，中国将有7亿人次出境旅游。中国拥有悠久历史、灿烂文化、壮美山川、多样风情，我们热情欢迎各国旅游者来华观光度假。联合国世界旅游组织为推动全球旅游业发展、加强国际旅游交流合作发挥着积极作用。希望各国以这次会议为契机，共同推动全球旅游事业取得更大发展。（新华社成都9月13日电）</p>\n</div>",
  "text": [
    "联合国世界旅游组织第22届全体大会13日在四川成都开幕。国家主席习近平向大会致贺词。",
    "习近平指出，旅游是不同国家、不同文化交流互鉴的重要渠道，是发展经济、增加就业的有效手段，也是提高人民生活水平的重要产业。",
    "习近平强调，中国高度重视发展旅游业，旅游业对中国经济和就业的综合贡献率已超过10%。未来5年，中国将有7亿人次出境旅游。中国拥有悠久历史、灿烂文化、壮美山川、多样风情，我们热情欢迎各国旅游者来华观光度假。联合国世界旅游组织为推动全球旅游业发展、加强国际旅游交流合作发挥着积极作用。希望各国以这次会议为契机，共同推动全球旅游事业取得更大发展。（新华社成都9月13日电）"
  ]
}
