{
  "id": "31477999",
  "title": "中国和苏里南宣布建立战略合作伙伴关系",
  "date": "2019-11-27 19:32:35",
  "author": "新华社",
  "editor": "王静",
  "article": "<div class=\"d2txt_con clearfix\">\n<p></p><p style=\"text-indent: 2em;\">\n11月27日，国家主席习近平在北京人民大会堂同苏里南总统鲍特瑟会谈。两国元首共同宣布，中苏建立战略合作伙伴关系。</p>\n</div>",
  "text": [
    "11月27日，国家主席习近平在北京人民大会堂同苏里南总统鲍特瑟会谈。两国元首共同宣布，中苏建立战略合作伙伴关系。"
  ]
}
