{
  "id": "31380423",
  "title": "习近平致电祝贺中国女排夺得2019年女排世界杯冠军",
  "date": "2019-09-29 19:42:23",
  "author": "新华社",
  "editor": "王珂园",
  "article": "<div class=\"d2txt_con clearfix\">\n<p></p><p style=\"text-indent: 2em;\">\n新华社日本大阪9月29日电 中国女排夺得2019年女排世界杯冠军，成功卫冕。中共中央总书记、国家主席、中央军委主席习近平致电，向中国女排全体队员、教练员表示热烈的祝贺和诚挚的问候。</p>\n<p style=\"text-indent: 2em;\">\n习近平指出，在2019年女排世界杯比赛中，你们以十一连胜的骄人成绩夺得了冠军，成功卫冕，为祖国和人民赢得了荣誉。你们在比赛中不畏强手、敢打敢拼，打出了风格、赛出了水平，充分展现了团结协作、顽强拼搏的女排精神。我向你们表示热烈的祝贺和诚挚的问候！</p>\n<p style=\"text-indent: 2em;\">\n习近平强调，今年是新中国成立70周年，新中国取得的举世瞩目的伟大成就是全党全国各族人民团结一心、艰苦奋斗干出来的。希望你们继续保持昂扬斗志，不骄不躁，再创佳绩。</p>\n<p style=\"text-indent: 2em;\">\n2019年女排世界杯9月14日至29日在日本举行，中国女排连克强手，取得十一连胜的骄人成绩，成功卫冕世界杯冠军。1981年，在第三届女排世界杯上，中国女排获得第一个世界冠军，之后创造了“五连冠”的辉煌成绩。38年来，中国女排在世界杯、世锦赛、奥运会三大赛事中屡创佳绩，形成了团结协作、顽强拼搏的女排精神。</p>\n</div>",
  "text": [
    "新华社日本大阪9月29日电 中国女排夺得2019年女排世界杯冠军，成功卫冕。中共中央总书记、国家主席、中央军委主席习近平致电，向中国女排全体队员、教练员表示热烈的祝贺和诚挚的问候。",
    "习近平指出，在2019年女排世界杯比赛中，你们以十一连胜的骄人成绩夺得了冠军，成功卫冕，为祖国和人民赢得了荣誉。你们在比赛中不畏强手、敢打敢拼，打出了风格、赛出了水平，充分展现了团结协作、顽强拼搏的女排精神。我向你们表示热烈的祝贺和诚挚的问候！",
    "习近平强调，今年是新中国成立70周年，新中国取得的举世瞩目的伟大成就是全党全国各族人民团结一心、艰苦奋斗干出来的。希望你们继续保持昂扬斗志，不骄不躁，再创佳绩。",
    "2019年女排世界杯9月14日至29日在日本举行，中国女排连克强手，取得十一连胜的骄人成绩，成功卫冕世界杯冠军。1981年，在第三届女排世界杯上，中国女排获得第一个世界冠军，之后创造了“五连冠”的辉煌成绩。38年来，中国女排在世界杯、世锦赛、奥运会三大赛事中屡创佳绩，形成了团结协作、顽强拼搏的女排精神。"
  ]
}
