{
  "id": "32523702",
  "title": "习近平就朝鲜国庆74周年向朝鲜最高领导人金正恩致贺电",
  "date": "2022-09-10 08:04:38",
  "author": "人民网－人民日报",
  "editor": "(责编：任一林                     )",
  "article": "<div class=\"d2txt_con clearfix\">\n<p><p style=\"text-indent: 2em;\">\n\t新华社北京9月9日电  9月9日，中共中央总书记、国家主席习近平就朝鲜国庆74周年向朝鲜劳动党总书记、国务委员长金正恩致贺电。</p>\n<p style=\"text-indent: 2em;\">\n\t习近平指出，74年来，朝鲜人民紧密团结在朝鲜劳动党周围，砥砺奋进，推动社会主义建设事业取得重要成就。近年来，在朝鲜劳动党八大确定的方针政策指引下，朝鲜人民在发展经济、改善民生方面不断取得新成果，并成功抗击新冠肺炎疫情。作为好同志、好邻居、好朋友，我们对此感到由衷高兴。相信在总书记同志和朝鲜劳动党领导下，兄弟的朝鲜人民一定能够推动朝鲜社会主义事业实现新发展、迈上新台阶。</p>\n<p style=\"text-indent: 2em;\">\n\t习近平指出，中朝两国山水相连，传统友谊历久弥坚。我同总书记同志就规划两党两国关系发展蓝图、充实中朝友谊时代内涵达成一系列重要共识。中朝友好更加深入人心，两国交流合作持续推进，双方在彼此重大关切问题上相互支持，彰显了中朝传统友谊的蓬勃生机。</p>\n<p style=\"text-indent: 2em;\">\n\t习近平强调，百年未有之大变局加速演进，世界进入新的动荡变革期。中方愿同朝方保持战略沟通，加强协调合作，共同维护好、巩固好、发展好中朝关系，更好造福两国和两国人民，为地区乃至世界和平稳定与发展繁荣作出贡献。</p>\n<p style=\"text-indent: 2em;\">\n<span id=\"paper_num\" style=\"text-indent: 2em; display: block;\">《 人民日报 》（ 2022年09月10日 01 版）</span></p>\n</p>\n</div>",
  "text": [
    "新华社北京9月9日电  9月9日，中共中央总书记、国家主席习近平就朝鲜国庆74周年向朝鲜劳动党总书记、国务委员长金正恩致贺电。",
    "习近平指出，74年来，朝鲜人民紧密团结在朝鲜劳动党周围，砥砺奋进，推动社会主义建设事业取得重要成就。近年来，在朝鲜劳动党八大确定的方针政策指引下，朝鲜人民在发展经济、改善民生方面不断取得新成果，并成功抗击新冠肺炎疫情。作为好同志、好邻居、好朋友，我们对此感到由衷高兴。相信在总书记同志和朝鲜劳动党领导下，兄弟的朝鲜人民一定能够推动朝鲜社会主义事业实现新发展、迈上新台阶。",
    "习近平指出，中朝两国山水相连，传统友谊历久弥坚。我同总书记同志就规划两党两国关系发展蓝图、充实中朝友谊时代内涵达成一系列重要共识。中朝友好更加深入人心，两国交流合作持续推进，双方在彼此重大关切问题上相互支持，彰显了中朝传统友谊的蓬勃生机。",
    "习近平强调，百年未有之大变局加速演进，世界进入新的动荡变革期。中方愿同朝方保持战略沟通，加强协调合作，共同维护好、巩固好、发展好中朝关系，更好造福两国和两国人民，为地区乃至世界和平稳定与发展繁荣作出贡献。",
    "《 人民日报 》（ 2022年09月10日 01 版）"
  ]
}
