{
  "id": "27833402",
  "title": "习近平就我国公民被恐怖组织杀害事件发表讲话",
  "date": "2015-11-19 11:17:07",
  "author": "新华社",
  "editor": "姜萍萍",
  "article": "<div class=\"d2txt_con clearfix\">\n<p></p><p style=\"text-indent: 2em;\">\n１１月１９日，正在菲律宾马尼拉出席亚太经合组织第二十三次领导人非正式会议的国家主席习近平就我国公民被恐怖组织杀害事件发表讲话。</p>\n<p style=\"text-indent: 2em;\">\n习近平表示，中国强烈谴责“伊斯兰国”极端组织残忍杀害中国公民这一暴行。我向遇害者家属表示深切慰问。恐怖主义是人类的公敌，中国坚决反对一切形式的恐怖主义，坚决打击任何挑战人类文明底线的暴恐犯罪活动。（新华社马尼拉１１月１９日电）</p>\n</div>",
  "text": [
    "１１月１９日，正在菲律宾马尼拉出席亚太经合组织第二十三次领导人非正式会议的国家主席习近平就我国公民被恐怖组织杀害事件发表讲话。",
    "习近平表示，中国强烈谴责“伊斯兰国”极端组织残忍杀害中国公民这一暴行。我向遇害者家属表示深切慰问。恐怖主义是人类的公敌，中国坚决反对一切形式的恐怖主义，坚决打击任何挑战人类文明底线的暴恐犯罪活动。（新华社马尼拉１１月１９日电）"
  ]
}
