{
  "id": "24918351",
  "title": "习近平同加蓬总统邦戈互致贺电庆祝两国建交40周年",
  "date": "2014-04-20 10:55:55",
  "author": "新华网",
  "editor": "权娟",
  "article": "<div class=\"d2txt_con clearfix\">\n<p></p><p style=\"text-indent: 2em;\">\n国家主席习近平２０日同加蓬总统邦戈互致贺电，庆祝中加建交４０周年。</p>\n<p style=\"text-indent: 2em;\">\n习近平在贺电中说，４０年前，中加两国老一辈领导人作出建立大使级外交关系的决定，推动中加友好事业进入新的发展阶段。４０年来，中加两国政府和人民相互尊重、相互支持、真诚合作，结下了深厚友谊。进入新世纪以来，中加关系更是取得飞速发展，两国人民从双方合作中获益良多。中加同为发展中国家，同为中非命运共同体的成员，同样在为国家和民族发展振兴而奋斗。新形势下，把中加关系发展好符合两国人民根本利益。我高度重视中加关系发展，中方愿同加方一道，巩固传统友谊，深化友好合作，使中加关系焕发出新的生机活力。</p>\n<p style=\"text-indent: 2em;\">\n邦戈在贺电中说，加中建交４０年来，两国友好合作始终健康稳定发展。中国积极参与加蓬国家发展建设，是加实施“新兴加蓬战略计划”的重要战略伙伴。借此机会，我谨代表加蓬政府和人民并以我个人名义，对中国在加完成的诸多建设项目表示由衷的满意。此外，两国在多边事务中进行了成功合作。双方在许多重大问题上观点相近，在国际机构中保持着坦诚友好的合作与交流。我愿与你共同努力，不断深化和扩大加中两国间富有成果的友好合作关系。</p>\n<p style=\"text-indent: 2em;\">\n外交部长王毅也就中加建交４０周年与加外长恩贡代互致贺电。（新华网北京４月２０日电）</p>\n</div>",
  "text": [
    "国家主席习近平２０日同加蓬总统邦戈互致贺电，庆祝中加建交４０周年。",
    "习近平在贺电中说，４０年前，中加两国老一辈领导人作出建立大使级外交关系的决定，推动中加友好事业进入新的发展阶段。４０年来，中加两国政府和人民相互尊重、相互支持、真诚合作，结下了深厚友谊。进入新世纪以来，中加关系更是取得飞速发展，两国人民从双方合作中获益良多。中加同为发展中国家，同为中非命运共同体的成员，同样在为国家和民族发展振兴而奋斗。新形势下，把中加关系发展好符合两国人民根本利益。我高度重视中加关系发展，中方愿同加方一道，巩固传统友谊，深化友好合作，使中加关系焕发出新的生机活力。",
    "邦戈在贺电中说，加中建交４０年来，两国友好合作始终健康稳定发展。中国积极参与加蓬国家发展建设，是加实施“新兴加蓬战略计划”的重要战略伙伴。借此机会，我谨代表加蓬政府和人民并以我个人名义，对中国在加完成的诸多建设项目表示由衷的满意。此外，两国在多边事务中进行了成功合作。双方在许多重大问题上观点相近，在国际机构中保持着坦诚友好的合作与交流。我愿与你共同努力，不断深化和扩大加中两国间富有成果的友好合作关系。",
    "外交部长王毅也就中加建交４０周年与加外长恩贡代互致贺电。（新华网北京４月２０日电）"
  ]
}
